{
  "$schema": "https://json-schema.org/draft/2020-12/schema",
  "title": "Application",
  "type": "object",
  "description": "Represents an application registration in Azure AD. An application object is the global definition of an application, specifying how tokens are issued, the resources the application needs to access, and the actions it can perform.",
  "properties": {
    "appId": {
      "type": "string",
      "description": "The unique identifier assigned by Azure AD when the app is registered. Also known as the client ID."
    },
    "displayName": {
      "type": "string",
      "description": "The display name for the application."
    },
    "description": {
      "type": "['string', 'null']",
      "description": "A free text field to describe the application."
    },
    "createdDateTime": {
      "type": "string",
      "description": "The date and time the application was registered."
    },
    "identifierUris": {
      "type": "array",
      "description": "URIs that identify the application within its Azure AD tenant. Also known as App ID URIs."
    },
    "keyCredentials": {
      "type": "array",
      "description": "The collection of key credentials (certificates) associated with the application."
    },
    "passwordCredentials": {
      "type": "array",
      "description": "The collection of password credentials (client secrets) associated with the application."
    },
    "appRoles": {
      "type": "array",
      "description": "The collection of roles defined for the application."
    },
    "requiredResourceAccess": {
      "type": "array",
      "description": "Specifies the resources that the application needs access to."
    },
    "signInAudience": {
      "type": "string",
      "description": "Specifies the Microsoft accounts supported for the current application."
    },
    "tags": {
      "type": "array",
      "description": "Custom strings that can be used to categorize the application."
    },
    "publisherDomain": {
      "type": "string",
      "description": "The verified publisher domain for the application."
    }
  }
}